{
  "$schema": "../../schemas/questions.schema.json",
  "versionId": "2025",
  "reviewStatus": "approved",
  "sources": [
    {
      "authority": "USCIS",
      "title": "128 Civics Questions and Answers (2025 version), M-1778 (09/25)",
      "url": "https://www.uscis.gov/sites/default/files/document/questions-and-answers/2025-Civics-Test-128-Questions-and-Answers.pdf",
      "verifiedOn": "2026-09-01",
      "license": "Public domain (U.S. Government work, 17 U.S.C. § 105)"
    },
    {
      "authority": "USCIS",
      "title": "2025 Civics Test",
      "url": "https://www.uscis.gov/citizenship-resource-center/naturalization-test-and-study-resources/2025-civics-test",
      "verifiedOn": "2026-09-01",
      "license": "Public domain (U.S. Government work, 17 U.S.C. § 105)"
    }
  ],
  "questions": [
    {
      "id": "2025-001",
      "number": 1,
      "category": "American Government",
      "subcategory": "Principles of American Government",
      "prompt": "What is the form of government of the United States?",
      "acceptedAnswers": [
        "Republic",
        "Constitution-based federal republic",
        "Representative democracy"
      ]
    },
    {
      "id": "2025-002",
      "number": 2,
      "category": "American Government",
      "subcategory": "Principles of American Government",
      "prompt": "What is the supreme law of the land?",
      "acceptedAnswers": [
        "(U.S.) Constitution"
      ]
    },
    {
      "id": "2025-003",
      "number": 3,
      "category": "American Government",
      "subcategory": "Principles of American Government",
      "prompt": "Name one thing the U.S. Constitution does.",
      "acceptedAnswers": [
        "Forms the government",
        "Defines powers of government",
        "Defines the parts of government",
        "Protects the rights of the people"
      ]
    },
    {
      "id": "2025-004",
      "number": 4,
      "category": "American Government",
      "subcategory": "Principles of American Government",
      "prompt": "The U.S. Constitution starts with the words \"We the People.\" What does \"We the People\" mean?",
      "acceptedAnswers": [
        "Self-government",
        "Popular sovereignty",
        "Consent of the governed",
        "People should govern themselves",
        "(Example of) social contract"
      ]
    },
    {
      "id": "2025-005",
      "number": 5,
      "category": "American Government",
      "subcategory": "Principles of American Government",
      "prompt": "How are changes made to the U.S. Constitution?",
      "acceptedAnswers": [
        "Amendments",
        "The amendment process"
      ]
    },
    {
      "id": "2025-006",
      "number": 6,
      "category": "American Government",
      "subcategory": "Principles of American Government",
      "prompt": "What does the Bill of Rights protect?",
      "acceptedAnswers": [
        "(The basic) rights of Americans",
        "(The basic) rights of people living in the United States"
      ]
    },
    {
      "id": "2025-007",
      "number": 7,
      "category": "American Government",
      "subcategory": "Principles of American Government",
      "prompt": "How many amendments does the U.S. Constitution have?",
      "acceptedAnswers": [
        "Twenty-seven (27)"
      ]
    },
    {
      "id": "2025-008",
      "number": 8,
      "category": "American Government",
      "subcategory": "Principles of American Government",
      "prompt": "Why is the Declaration of Independence important?",
      "acceptedAnswers": [
        "It says America is free from British control.",
        "It says all people are created equal.",
        "It identifies inherent rights.",
        "It identifies individual freedoms."
      ]
    },
    {
      "id": "2025-009",
      "number": 9,
      "category": "American Government",
      "subcategory": "Principles of American Government",
      "prompt": "What founding document said the American colonies were free from Britain?",
      "acceptedAnswers": [
        "Declaration of Independence"
      ]
    },
    {
      "id": "2025-010",
      "number": 10,
      "category": "American Government",
      "subcategory": "Principles of American Government",
      "prompt": "Name two important ideas from the Declaration of Independence and the U.S. Constitution.",
      "acceptedAnswers": [
        "Equality",
        "Liberty",
        "Social contract",
        "Natural rights",
        "Limited government",
        "Self-government"
      ],
      "requiredCount": 2
    },
    {
      "id": "2025-011",
      "number": 11,
      "category": "American Government",
      "subcategory": "Principles of American Government",
      "prompt": "The words \"Life, Liberty, and the pursuit of Happiness\" are in what founding document?",
      "acceptedAnswers": [
        "Declaration of Independence"
      ]
    },
    {
      "id": "2025-012",
      "number": 12,
      "category": "American Government",
      "subcategory": "Principles of American Government",
      "prompt": "What is the economic system of the United States?",
      "acceptedAnswers": [
        "Capitalism",
        "Free market economy"
      ]
    },
    {
      "id": "2025-013",
      "number": 13,
      "category": "American Government",
      "subcategory": "Principles of American Government",
      "prompt": "What is the rule of law?",
      "acceptedAnswers": [
        "Everyone must follow the law.",
        "Leaders must obey the law.",
        "Government must obey the law.",
        "No one is above the law."
      ]
    },
    {
      "id": "2025-014",
      "number": 14,
      "category": "American Government",
      "subcategory": "Principles of American Government",
      "prompt": "Many documents influenced the U.S. Constitution. Name one.",
      "acceptedAnswers": [
        "Declaration of Independence",
        "Articles of Confederation",
        "Federalist Papers",
        "Anti-Federalist Papers",
        "Virginia Declaration of Rights",
        "Fundamental Orders of Connecticut",
        "Mayflower Compact",
        "Iroquois Great Law of Peace"
      ]
    },
    {
      "id": "2025-015",
      "number": 15,
      "category": "American Government",
      "subcategory": "Principles of American Government",
      "prompt": "There are three branches of government. Why?",
      "acceptedAnswers": [
        "So one part does not become too powerful",
        "Checks and balances",
        "Separation of powers"
      ]
    },
    {
      "id": "2025-016",
      "number": 16,
      "category": "American Government",
      "subcategory": "System of Government",
      "prompt": "Name the three branches of government.",
      "acceptedAnswers": [
        "Legislative, executive, and judicial",
        "Congress, president, and the courts"
      ]
    },
    {
      "id": "2025-017",
      "number": 17,
      "category": "American Government",
      "subcategory": "System of Government",
      "prompt": "The President of the United States is in charge of which branch of government?",
      "acceptedAnswers": [
        "Executive branch"
      ]
    },
    {
      "id": "2025-018",
      "number": 18,
      "category": "American Government",
      "subcategory": "System of Government",
      "prompt": "What part of the federal government writes laws?",
      "acceptedAnswers": [
        "(U.S.) Congress",
        "(U.S. or national) legislature",
        "Legislative branch"
      ]
    },
    {
      "id": "2025-019",
      "number": 19,
      "category": "American Government",
      "subcategory": "System of Government",
      "prompt": "What are the two parts of the U.S. Congress?",
      "acceptedAnswers": [
        "Senate and House (of Representatives)"
      ]
    },
    {
      "id": "2025-020",
      "number": 20,
      "category": "American Government",
      "subcategory": "System of Government",
      "prompt": "Name one power of the U.S. Congress.",
      "acceptedAnswers": [
        "Writes laws",
        "Declares war",
        "Makes the federal budget"
      ]
    },
    {
      "id": "2025-021",
      "number": 21,
      "category": "American Government",
      "subcategory": "System of Government",
      "prompt": "How many U.S. senators are there?",
      "acceptedAnswers": [
        "One hundred (100)"
      ]
    },
    {
      "id": "2025-022",
      "number": 22,
      "category": "American Government",
      "subcategory": "System of Government",
      "prompt": "How long is a term for a U.S. senator?",
      "acceptedAnswers": [
        "Six (6) years"
      ]
    },
    {
      "id": "2025-023",
      "number": 23,
      "category": "American Government",
      "subcategory": "System of Government",
      "prompt": "Who is one of your state's U.S. senators now?",
      "acceptedAnswers": [],
      "dynamicAnswerKey": "state-senator",
      "note": "Answers will vary. [District of Columbia residents and residents of U.S. territories should answer that D.C. (or the territory where the applicant lives) has no U.S. senators.]"
    },
    {
      "id": "2025-024",
      "number": 24,
      "category": "American Government",
      "subcategory": "System of Government",
      "prompt": "How many voting members are in the House of Representatives?",
      "acceptedAnswers": [
        "Four hundred thirty-five (435)"
      ]
    },
    {
      "id": "2025-025",
      "number": 25,
      "category": "American Government",
      "subcategory": "System of Government",
      "prompt": "How long is a term for a member of the House of Representatives?",
      "acceptedAnswers": [
        "Two (2) years"
      ]
    },
    {
      "id": "2025-026",
      "number": 26,
      "category": "American Government",
      "subcategory": "System of Government",
      "prompt": "Why do U.S. representatives serve shorter terms than U.S. senators?",
      "acceptedAnswers": [
        "To more closely follow public opinion"
      ]
    },
    {